{
  "$schema": "https://json-schema.org/draft/2020-12/schema",
  "title": "IQR Credential Envelope",
  "type": "object",
  "required": ["id", "type", "issuer", "documentHash", "version"],
  "properties": {
    "id": {"type": "string", "minLength": 1},
    "type": {"type": "string", "minLength": 1},
    "issuer": {"type": "string", "minLength": 1},
    "documentHash": {"type": "string", "pattern": "^sha256:[A-Fa-f0-9]{64}$"},
    "version": {"type": "string", "minLength": 1},
    "issuedAt": {"type": "string", "format": "date-time"},
    "expiresAt": {"type": "string", "format": "date-time"},
    "status": {"type": "string"},
    "proof": {"type": "object"}
  },
  "additionalProperties": true
}
